row_number,question,answer,coherence_score,faithfulness_score,answer_relevancy_score
25,"What series of philosophical arguments presented by an ancient Greek philosopher does Jim Simons, the founder of Renaissance Technologies, learn about as a 4-year-old that sparks his interest in math?","As a 4-year-old, Jim Simons, the founder of Renaissance Technologies, stumbled into one of Zeno's famous paradoxes from ancient Greek philosophy. The specific paradox he encountered is related to the concept of division and infinite sequences. The basic gist of Zeno's paradoxes is that if you are always taking a quantity and dividing it by two, you will never reach zero; you will only asymptotically approach zero. This concept intrigued young Jim Simons and sparked his interest in mathematics. The context provided an example of this paradox: Jim suggested that if they only used half the gas in the tank, they would still have gas left after that, and so on, which reflects the idea of Zeno's paradox about infinite divisibility.",0.8951858717268368,1.0,1.0
26,"In the year 2000, when the tech bubble bursts and the market is down big, what was the Medallion Fund's % gross returns?","In the year 2000, when the tech bubble burst and the market was down significantly, the Medallion Fund achieved gross returns of 128%. This performance was particularly notable because it occurred during a period when the broader market was experiencing substantial declines. The Medallion Fund's ability to generate such high returns in a volatile and declining market environment highlights its effectiveness and the robustness of its trading strategies.",0.9924141811916829,1.0,1.0
27,who was the first rocket engine engineer in spacex,"The first rocket engine engineer at SpaceX was Tom Mueller. He was known in the industry as a real savant about engines and was considered probably the best, most impressive rocket engine engineer in the world. Elon Musk met Tom Mueller and started asking him questions about how rocket engines work and what needs to go into building a rocket. Mueller helped Musk put together a detailed spec sheet with costs and all the materials needed to build a rocket, which was instrumental in the early development of SpaceX's rocket technology.",0.9268941413505519,1.0,0.625
28,can you tell me total number of people working in Spacex,The exact number of people working at SpaceX is not included in the provided context.,0.1391671162814479,1.0,1.0
29,What is the cost of rocket travel based on the materials?,"The cost of rocket travel, when broken down to the materials used, is surprisingly low compared to the final price of a rocket. According to the context provided, the cost of goods sold for aerospace-grade materials such as aluminum alloys, titanium, copper, and carbon fiber on the open commodities market is about 2% of what rockets cost. This suggests that the raw materials themselves are a very small fraction of the total cost of a rocket.

The context further explains that in most manufacturing businesses, the actual hard materials typically constitute a much larger percentage of the final product's cost. However, in the aerospace industry, particularly with rockets, the cost is significantly inflated due to other factors. These include the complexity of manufacturing, the need for precision engineering, the extensive testing required, and the high costs associated with ensuring reliability and safety in space travel.

Additionally, the context highlights that the traditional aerospace industry has been characterized by a horizontally-integrated supply chain with multiple layers of subcontractors, each adding their own profit margins. This results in an ""exponential GNA"" (General and Administrative expenses) effect, where costs multiply as each layer adds its own overhead and profit margin. This is a significant factor in the high cost of rockets beyond just the raw materials.

In summary, while the raw materials for rockets are relatively inexpensive, the overall cost of rocket travel is driven up by the complex manufacturing processes, the need for high reliability and safety, and the traditional industry structure with multiple layers of subcontractors each adding to the cost.",0.9777299861174692,1.0,1.0
30,what is the idea about mars oasis,"The idea of the Mars Oasis was an early concept developed by Elon Musk as a way to inspire interest and excitement in space exploration. The plan was to create a ""grand gesture"" that would capture the public's imagination and reignite enthusiasm for space travel. The Mars Oasis project involved purchasing a rocket and sending it to Mars with a payload that included a plant and a robot. The robot would create a greenhouse on Mars, plant the seed, and allow it to grow. The entire process would be captured on video and streamed back to Earth, providing a live feed of a plant growing on Mars. This visual spectacle was intended to serve as a modern equivalent of the iconic ""Earthrise"" photo taken during the Apollo missions, aiming to inspire people worldwide to support and engage with space exploration. The project was initially conceived as a philanthropic and inspirational endeavor rather than a commercial venture. However, the high costs associated with purchasing a rocket and executing the mission led Musk to reconsider the approach, eventually leading to the founding of SpaceX with the broader goal of reducing space transportation costs and enabling the colonization of Mars.",0.9851952803229602,1.0,1.0
31,What was Elon Musk�s initial investment in SpaceX?,"Elon Musk's initial investment in SpaceX was approximately $100 million. After the sale of PayPal to eBay in July 2002, Musk received over $180 million in cash. He decided to invest a significant portion of his fortune into SpaceX, which he founded in June 2002. Musk was determined to fund the company himself to maintain control and ensure that he could not be ousted, as had happened in his previous ventures. This initial investment was crucial in getting SpaceX off the ground and allowed the company to develop its first rockets and engines without relying on outside investors.",0.9731058570765526,1.0,0.8
32,How is Jim Weber's strategic focus influence the revitalization of Brooks Running?,"Jim Weber's strategic focus played a pivotal role in the revitalization of Brooks Running by implementing a clear and concentrated strategy centered on performance running. When Weber took over as CEO in 2001, Brooks was struggling financially, with a broad product line that included various types of footwear beyond running shoes. The company was losing money and was in debt, with a weak brand presence in the market.

Weber's strategy involved a bold decision to narrow the company's focus exclusively to performance running shoes, shedding all other product lines. This focus allowed Brooks to concentrate its resources and efforts on a single category, which was the largest in the athletic footwear industry. By doing so, Brooks could develop a deep expertise and create high-quality products tailored specifically for runners, which helped in building a strong brand identity.

This strategic focus also meant that Brooks could better serve its target market of frequent runners, who are likely to purchase multiple pairs of shoes annually. By concentrating on this segment, Brooks was able to build customer loyalty and increase its market share. The company invested heavily in research and development to ensure that its products met the specific needs of runners, focusing on biomechanics and the fit, feel, and ride of the shoes.

Weber's leadership also involved negotiating independence for Brooks when it was acquired by larger companies, such as Russell Athletic and later Fruit of the Loom, which was owned by Berkshire Hathaway. This independence allowed Brooks to maintain its strategic focus and continue its growth trajectory without being subsumed into the broader operations of its parent companies.

Under Weber's leadership, Brooks Running grew significantly, achieving profitability and eventually becoming the number one running shoe brand in the United States. The company's success was further bolstered by its ability to adapt to market changes, such as the increased interest in running during the COVID-19 pandemic, which Brooks capitalized on by quickly turning its supply chain back on and meeting the rising demand for running shoes.

Overall, Jim Weber's strategic focus on performance running, combined with his ability to maintain the company's independence and adapt to market conditions, was instrumental in revitalizing Brooks Running and establishing it as a leading brand in the athletic footwear industry.",0.9946596676771859,0.8888888888888888,1.0
33,How did Brooks Running approach to market segmentation give it a competitive advantage?,"Brooks Running's approach to market segmentation gave it a competitive advantage by focusing exclusively on performance running gear and targeting frequent runners. This strategic decision allowed Brooks to differentiate itself from competitors who offered a broad range of athletic footwear and apparel across various sports and price points. By narrowing its focus, Brooks was able to concentrate its resources and expertise on developing high-quality running shoes that catered specifically to the needs of serious runners.

1. **Targeting Frequent Runners**: Brooks identified that the real business opportunity lay in trainers rather than racing shoes or spikes. Frequent runners, who put in 20-30 miles a week, would go through multiple pairs of shoes annually, creating a recurring revenue stream. By focusing on this segment, Brooks built customer loyalty and ensured repeat purchases.

2. **Product Development and Innovation**: Brooks invested heavily in R&D to create running shoes that addressed the biomechanics and habitual joint motion of runners. This focus on engineering materials specifically for running ensured that Brooks' products met the high standards of performance runners, further solidifying its reputation in the market.

3. **Brand Positioning**: Brooks positioned itself as a brand that celebrated all runners, not just elite athletes. This inclusive approach made the brand approachable and appealing to a broader audience, including those new to running. The brand's emphasis on performance without the seriousness associated with competition resonated with its target market.

4. **Retail Partnerships and Multichannel Strategy**: Brooks developed strong partnerships with specialty running stores and other retailers that catered to its target market. This allowed Brooks to effectively reach its audience and provide them with the products they needed. The company's ability to adapt to digital sales channels during the pandemic further demonstrated its agility and understanding of market dynamics.

5. **Data-Driven Insights**: Brooks leveraged data from platforms like Strava to understand running trends and participation rates. This data-driven approach allowed Brooks to anticipate market needs and adjust its strategies accordingly, ensuring that it remained relevant and competitive.

Overall, Brooks Running's focused market segmentation strategy allowed it to build a strong brand identity, foster customer loyalty, and maintain a competitive edge in the performance running market.",0.9880797080077756,0.875,1.0
34,What was the patent Heddy developed? Was it publicly available?,"Hedy Lamarr, along with her neighbor George Antheil, developed a novel technique to defeat radio frequency (RF) jamming by using frequency hopping. This concept was described in a patent they were issued, which became the origin of spread spectrum technology. The patent was issued in 1942 and remained confidential for decades within the U.S. military. It was not declassified until 1981, meaning it was not publicly available for nearly four decades. The technique involved using frequency hopping to transmit messages across a variety of spectrums, which could evade jamming and was also efficient for using radio bandwidth.",0.9437823499114202,1.0,1.0
35,Why were patents developed by Heddy had 88 frequency hops ?,"The patents developed by Hedy Lamarr and George Antheil had 88 frequency hops because they used the concept of a piano keyboard to design their frequency hopping system. In their prototype, they utilized player piano scrolls, which are essentially rolls of paper with perforations that dictate the notes to be played on a player piano. Each note on the piano was mapped to a different frequency. Since a standard piano has 88 keys, their system incorporated 88 frequency hops, corresponding to the 88 keys on a piano. This innovative approach allowed them to create a method for frequency hopping, which was intended to prevent radio jamming by rapidly switching frequencies during transmission.",0.9904650533375733,1.0,1.0
36,What was the role of Trump administration on the takeover of Broadcomm over Qualcomm and why the decision was made?,The exact information regarding the role of the Trump administration in the takeover of Broadcom over Qualcomm and the reasons for the decision is not included in the provided context.,0.22903254120494482,1.0,1.0
37,what is one decision Porsche made to improve business that went against industry norm?,"One significant decision Porsche made to improve its business, which went against industry norms, was the introduction of the Porsche Cayenne SUV in 2003. At the time, Porsche was primarily known for its sports cars, particularly the iconic 911. The decision to enter the SUV market was seen as controversial and risky, as it diverged from Porsche's traditional brand image centered around high-performance sports cars.

The Cayenne was Porsche's first foray into the SUV segment, and it was a move that many industry observers and enthusiasts initially criticized. The SUV market was not typically associated with luxury sports car manufacturers, and there was a concern that producing an SUV could dilute Porsche's brand identity and alienate its core customer base.

However, the decision to produce the Cayenne proved to be a strategic masterstroke. The SUV became a massive commercial success, significantly boosting Porsche's sales and profitability. It allowed Porsche to tap into a rapidly growing market segment and attract a new customer base, including families and individuals seeking a luxury vehicle with more practicality than a traditional sports car.

The success of the Cayenne demonstrated that Porsche could expand its product lineup beyond sports cars without compromising its brand value. It also paved the way for the introduction of other non-traditional models, such as the Panamera sedan and the Macan compact SUV, further solidifying Porsche's position as a versatile luxury car manufacturer.

This strategic move not only helped Porsche weather economic downturns by diversifying its product offerings but also contributed to the company's long-term growth and financial stability. The Cayenne's success showed that Porsche could innovate and adapt to changing market demands while maintaining its reputation for quality and performance.",0.9966914021675279,1.0,0.96
38,What city owns 20% of volkswagen and why,"The city that owns 20% of Volkswagen is the state of Lower Saxony in Germany. This ownership is a result of the Volkswagen Law, which was designed to protect Volkswagen from takeovers. The law stipulates that no shareholder in Volkswagen AG can exercise more than 20% of the firm's voting rights, regardless of their level of stock holding. This law was intended to safeguard Volkswagen as a national treasure and prevent it from being taken over by corporate raiders. The state of Lower Saxony's ownership is part of this protective measure, ensuring that Volkswagen remains under significant German control.",0.9904650525612515,1.0,1.0
39,What's Startup Garage at Stanford's GSB?,"Startup Garage is a class at Stanford's Graduate School of Business (GSB) that is co-taught with the design school, the d.school. It is an interdisciplinary, two-quarter class where students apply as fully-formed teams to build a product or service with the intention of launching a company as part of the class. The course is designed to encourage students to create and develop a startup, providing them with the opportunity to work on real-world entrepreneurial projects. The class is known for its focus on practical application and innovation, and it has a reputation for being a ""legendary"" class at GSB.",0.9817574482159502,1.0,1.0
40,Who is the owner of the shop that ispired the idea behind the doordash app?,"The owner of the shop that inspired the idea behind the DoorDash app is a woman named Chloe, who owned the Chantal Guillon Macaron Shop in Downtown Palo Alto. During a design interview with the DoorDash founders, Chloe expressed her frustration with managing delivery orders, as she had no drivers to fulfill them and was handling all the deliveries herself. This revelation led the founders to explore the delivery needs of other local businesses, ultimately inspiring the creation of DoorDash.",0.9904650532513152,1.0,1.0
41,Where was the first customer of paloaltodelivery.com working at? what was he doing at Stanford?,"The first customer of paloaltodelivery.com was Bruce Barcott. He was working at Leafly, a marijuana company, and had written a book called ""Weed the People"" about legalizing marijuana. At the time of his order, he was a visiting author at Stanford.",0.8330807027252686,1.0,1.0
42,What seminar did Sam Walton enroll himself in in poughkeepsie New York,"In 1966, Sam Walton enrolled himself in a seminar at IBM in Poughkeepsie, New York. The seminar was focused on how to use computing technology in business. Walton, who was the Chairman and CEO of Walmart at the time, was starting to get the sense that computing technology could be a significant disruptor in the retail industry, much like discounting had been. Despite his initial reluctance to spend money on computers, he recognized the potential benefits of technology for Walmart's operations and wanted to learn more about it. This seminar marked the beginning of Walmart's journey into becoming a technology-driven company, which played a crucial role in its growth and success.",0.993991334835761,1.0,1.0
43,What Percentage of Rent to Sales did Sam Waltons first Ben Franklin cost,Sam Walton's first Ben Franklin store had a rent that was 5% of sales. This was considered the highest rent anybody had ever heard of in the variety store business at the time.,0.47580944664546554,1.0,1.0
44,How much top line revenue % did walmart see a year after their IPO 1972,"A year after Walmart's IPO in 1970, they experienced a top line revenue growth of 77%.",0.19831195916696875,1.0,0.0
45,why did Nvidia use a startup Foundry emulation software to produce their chips at some point,"NVIDIA used a startup's foundry emulation software to produce their chips because they were in a critical situation where they needed to design and ship a new chip within a very tight timeline of nine months, which was much shorter than the typical two-year cycle for chip design. This urgency was due to the company being on the brink of bankruptcy, with only nine months of runway left.

The traditional process of designing chips involved working on the design, sending it to a foundry to produce prototypes, testing them, and going back and forth a few times before finalizing the design, known as a tape-out. This process was too slow for NVIDIA's needs at the time.

To accelerate the process, Jensen Huang, NVIDIA's CEO, decided to use emulation technology to design their chips. This technology allowed them to emulate the graphics chip in software, which was significantly faster than the traditional method. However, the emulation was very slow, running at one frame every 30 seconds, making the debugging process extremely tedious. Despite this, it allowed NVIDIA to bypass the lengthy prototype testing phase and go directly to production.

They spent a significant portion of their remaining cash, about a third, on acquiring the emulation hardware and software. This decision was a high-risk, high-reward strategy that ultimately paid off, allowing them to ship the RIVA 128 chip in a fraction of the time it would have taken using traditional methods. This chip was a major success, selling one million units within four months and helping to save the company from bankruptcy.",0.9320821289929858,1.0,0.8636363636363636
46,What did Nvidia call its first graphics card,"NVIDIA's first graphics card was called the NV1. This was the initial product they developed after the company was founded. The NV1 was part of NVIDIA's early efforts to create a graphics card that could accelerate 3D graphics on consumer PCs, aiming to bring the high-end graphics capabilities of professional workstations to the consumer market.",0.928254872653814,1.0,1.0
47,Why did Jensen decide to write and send a letter through a physical address to Morris of TSMC,"Jensen Huang, the CEO of NVIDIA, decided to write and send a physical letter to Morris Chang, the founder of TSMC, because he was unable to get in touch with TSMC through any of the usual sales channels. At that time, NVIDIA was a relatively small and struggling company, and TSMC, being a major player in the semiconductor manufacturing industry, was not responsive to NVIDIA's attempts to establish a business relationship. By writing a letter directly to Morris Chang, Jensen aimed to bypass the standard communication barriers and appeal directly to the top decision-maker at TSMC. This direct approach was successful, as Morris Chang personally called Jensen after receiving the letter, which led to a significant partnership between NVIDIA and TSMC.",0.9904650541138945,1.0,1.0
48,What was Peloton original price,"Peloton originally priced their bike at $1200 when they first tried to start selling it. However, they realized that at this price point, people perceived the hardware as not being of high quality. To address this perception and position the bike as a premium, aspirational product, they raised the price to $2245. This price increase helped signal the value and quality of the bike to potential customers, which in turn helped sales take off.",0.9851952805752188,1.0,1.0
49,How much stock did John Foley had in Peloton in 2022,"In 2022, John Foley controlled approximately 39.6% of the voting power of Peloton's stock. This information is based on Peloton's proxy statement, as mentioned in the context.",0.2684712364307349,1.0,1.0
50,What percentage of NBA league revenue since 1983 has been contractually going to players?,"Since 1983, the NBA has had a collective bargaining agreement in place that stipulates that in aggregate, the league will pay the players 53% of the total gross revenue. This agreement effectively makes the players partners in the league's financial success, as they are entitled to over half of the revenue generated by the league. This revenue-sharing model has been a cornerstone of the NBA's economic structure since it was negotiated, ensuring that players receive a significant portion of the league's earnings.",0.9817574480668038,1.0,1.0
51,"What is the analogy in the Podcast for ""Bitcoin is calculator, let's build a computer""?","In the podcast, the analogy for ""Bitcoin is a calculator, let's build a computer"" is discussed in the context of Bitcoin's role and potential in the broader financial and technological ecosystem. The analogy is used to describe Bitcoin as a foundational technology that, while revolutionary in its own right, represents just the beginning of what can be achieved with blockchain and cryptocurrency technologies.

The podcast hosts discuss how Bitcoin was initially created to replace the payments layer on the internet, aiming to create a low transaction cost payment system with no fraud. However, as the technology and its use cases have evolved, it has become clear that Bitcoin is not ideally suited for high-velocity, low-value transactions due to its current limitations in speed and cost. Instead, Bitcoin has found a more fitting role as a secure store of value, akin to a digital gold, rather than a day-to-day transactional currency.

The analogy suggests that while Bitcoin is a powerful tool (like a calculator), there is potential to build more complex and capable systems (like a computer) on top of the foundational technology that Bitcoin represents. This is where other blockchain projects, such as Ethereum and decentralized finance (DeFi) applications, come into play. These projects aim to build more advanced and versatile systems that can handle a wider range of financial transactions and smart contracts, effectively expanding the capabilities of what blockchain technology can achieve beyond what Bitcoin alone can offer.

In summary, the analogy highlights the idea that Bitcoin is a starting point, a foundational technology that opens the door to more complex and capable systems in the blockchain and cryptocurrency space.",0.9348645123979361,1.0,0.6666666666666666
