row_number,question,answer,coherence_score,faithfulness_score,answer_relevancy_score
1,"When did Airbnb go public, what was the price per share","Airbnb went public on December 9, 2020. The IPO was priced at $68 per share.",0.6091949809906364,1.0,1.0
2,Why did Wimdu unlike Airbnb not take off?,"Wimdu, a competitor to Airbnb, did not take off for several reasons, as inferred from the context provided:

1. **Lack of Reviews and Trust**: One of the critical factors for Airbnb's success was the trust built through reviews. Reviews are essential for users to feel comfortable staying in a stranger's home or hosting strangers. Wimdu, being a clone of Airbnb, likely struggled to build a similar level of trust and community, as it would have had many listings with no reviews, making it less appealing to potential users.

2. **First-Mover Advantage and Network Effects**: Airbnb had already established a significant presence and network effect by the time Wimdu entered the market. Airbnb's global network effect was powerful, as it was not just about having listings but having a variety of reviewed and trusted listings. This made it difficult for Wimdu to compete, as users preferred a platform with more options and established trust.

3. **Strategic and Financial Backing**: Airbnb had strong financial backing and strategic moves, such as acquiring smaller competitors in Europe and opening offices to strengthen its presence. This aggressive expansion and consolidation of the market likely made it difficult for Wimdu to gain a foothold.

4. **Quality of Listings and User Experience**: Airbnb's focus on quality listings and user experience, including professional photography and smooth payment systems, may have given it an edge over Wimdu. Users are more likely to choose a platform that offers a seamless and reliable experience.

5. **Brand and Market Perception**: Airbnb had already built a strong brand and market perception as a pioneer in the home-sharing space. This brand recognition and loyalty can be challenging for a new entrant like Wimdu to overcome, especially when competing against a well-established player.

Overall, Wimdu's inability to replicate Airbnb's trust, network effects, strategic expansion, and brand strength likely contributed to its failure to take off in the same way Airbnb did.",0.9437823499114202,1.0,1.0
3,Why does market fragmentation work for airline industry but could't work for Airbnb,"Market fragmentation works for the airline industry but couldn't work for Airbnb due to several key differences in the nature of their services and the dynamics of their respective markets:

1. **Nature of Service and Infrastructure**:
   - **Airline Industry**: The airline industry involves significant infrastructure and operational requirements, such as aircraft, maintenance, and airport facilities. This creates natural barriers to entry and allows for regional players to thrive. Regional airlines can operate effectively within specific geographic areas, providing services that are tailored to local demand and infrastructure capabilities. Additionally, the airline industry benefits from alliances and partnerships that allow for a fragmented market to still offer global connectivity.
   - **Airbnb**: In contrast, Airbnb operates a platform that connects hosts and guests globally without owning the underlying real estate. The service is inherently global, as travelers often seek accommodations across different countries and regions. This global nature means that a fragmented market would struggle to provide the seamless, interconnected experience that users expect from a platform like Airbnb.

2. **Network Effects**:
   - **Airline Industry**: While network effects exist in the airline industry, they are often managed through alliances and code-sharing agreements, allowing airlines to offer extensive route networks without needing to operate globally themselves. This supports a fragmented market where regional players can still participate in a global network.
   - **Airbnb**: Airbnb benefits from strong network effects that are global in nature. Travelers value the ability to find accommodations anywhere in the world through a single platform. Fragmentation would dilute these network effects, as users would need to navigate multiple platforms to achieve the same global reach, reducing the overall value proposition of the service.

3. **Consumer Experience and Expectations**:
   - **Airline Industry**: Consumers often choose airlines based on specific routes, pricing, and service quality. The experience is relatively standardized, and consumers are accustomed to using different airlines for different legs of a journey.
   - **Airbnb**: Consumers expect a consistent and seamless experience when booking accommodations. They value the ability to compare a wide range of options in one place and trust the platform's review and payment systems. Fragmentation would complicate this process, as users would need to manage multiple accounts and systems, diminishing the convenience and trust that Airbnb provides.

4. **Market Dynamics and Competition**:
   - **Airline Industry**: The airline industry is characterized by high fixed costs and significant regulatory oversight, which can limit competition and support regional monopolies or oligopolies. This allows for a fragmented market where different players can dominate specific regions or niches.
   - **Airbnb**: The short-term rental market is more fluid and less regulated, allowing for rapid entry and exit of hosts. A single, dominant platform like Airbnb can leverage its scale to offer competitive pricing, a wide range of options, and a trusted brand, making it difficult for fragmented competitors to gain traction.

In summary, the airline industry's infrastructure, regional focus, and ability to form alliances support market fragmentation, while Airbnb's global network effects, consumer expectations for a seamless experience, and competitive dynamics favor a more consolidated market.",0.9468790626626242,1.0,1.0
4,How many hot dogs does Costco currently sell per year?,"Costco sells 130 million hot dogs per year. This figure is part of their food court offerings, which includes the famous $1.50 hot dog and soda deal that has been priced the same for many years.",0.8857889648298354,1.0,0.5
5,"What store was created as ""the price club of hardware stores""?","The store that was created as ""the Price Club of hardware stores"" is Home Depot. Bernie Marcus, who was the president running the Handy Dan hardware store chain, was kicked out by the board and was looking for a second act. Sol Price, the founder of Price Club, had Bernie Marcus out to San Diego, showed him the Price Club warehouse, and gave him the playbook. Sol encouraged Bernie to take the Price Club model and apply it to hardware stores. Bernie Marcus then went home, turned around, and started Home Depot, which became the ""Price Club of hardware stores.""",0.9437823499114202,1.0,1.0
6,How long did it take for Costco to generate 1 billion dollars in revenue?,"Costco reached 1 billion dollars in revenue in less than three years after its founding. This milestone was achieved in the 1980s, highlighting the rapid growth and success of the company during its early years.",0.8663175125901219,1.0,1.0
7,What is the New Look?,"The New Look was a revolutionary fashion collection introduced by Christian Dior in February 1947. It marked a significant departure from the styles that had dominated during World War II. The New Look was characterized by its feminine and soft aesthetic, featuring exaggerated silhouettes and the use of luxurious fabrics. This was a radical statement at the time, as it came right after the war when fabric rationing was still in place. The collection was a complete repudiation of the wartime aesthetic, which had been influenced by Nazi ideology that favored practicality and uniformity over the slender, feminine styles of Parisian fashion.

The New Look was not just a fashion statement but also a cultural one, symbolizing a new chapter for France and the world in the post-war era. It was about celebrating life and opulence after years of austerity. The collection was so impactful that it quickly became a financial success, with Dior fashions accounting for 75% of Paris's fashion exports and 5% of France's total export revenue by 1949. The term ""New Look"" was coined by the editor-in-chief of Harper's Bazaar, who exclaimed at the show, ""It is quite a revolution, Dear Christian. Your dresses have such a new look.""",0.9962673115314956,1.0,1.0
8,How much money did the Arnaut family offer to buy out the Boussac group?,"The Arnault family, led by Bernard Arnault, offered $60 million to buy out the Boussac group. Bernard Arnault's family put up $15 million of their own money, while the remaining $45 million was rounded up by Lazard Freres, the investment bank, which also invested some of their own balance sheet into the deal. This bid was made to take over the Boussac group from the French government, which had taken control of the company after it filed for bankruptcy.",0.9167003718665759,1.0,0.8571428571428571
9,What is American Crown Jewel?,"The exact information about ""American Crown Jewel"" is not included in the provided context.",0.1397351048968416,1.0,1.0
10,"According to Information Theory, what is the importance of knowing what message your sender is trying to convey?","In the context of Information Theory, knowing what message your sender is trying to convey is crucial for efficient communication, especially in noisy environments. This concept is tied to the idea of entropy and the predictability of messages.

1. **Entropy and Predictability**: Entropy in Information Theory refers to the measure of uncertainty or randomness in a message. If a receiver has a high expectation or predictability of what the message will be, the entropy is low. For example, if you are expecting a specific message like ""I just had breakfast,"" the actual transmission of this message can tolerate more noise because the receiver can fill in the gaps based on their expectations.

2. **Noise and Medium**: All communication occurs through a medium, which can introduce noise. The noisier the medium, the more difficult it is to accurately convey a message. However, if the receiver knows what to expect, they can more easily discern the intended message from the noise. This is akin to being in a loud room where you can still understand a familiar phrase despite the background noise.

3. **Efficient Use of Medium**: Knowing the expected message allows for more efficient use of the communication medium. If the message is predictable, it can be transmitted with less power or bandwidth, as the receiver can reconstruct the message even if parts of it are lost or distorted. This efficiency is crucial in environments with limited bandwidth or power, such as satellite communications or mobile networks.

4. **Error Correction and Redundancy**: When the expected message is known, error correction techniques can be more effectively applied. Redundancy can be minimized, and the communication system can focus on transmitting only the unpredictable parts of the message, thus optimizing the use of resources.

In summary, knowing what message your sender is trying to convey reduces the entropy of the message, allows for more efficient communication in noisy environments, and enables better error correction and resource optimization. This understanding is fundamental to designing communication systems that can operate effectively under various constraints.",0.9731058570765528,1.0,1.0
11,Compare the impact on Qualcomm between the two Jacobs.,"The impact of the two Jacobs, Irwin Jacobs and his son Paul Jacobs, on Qualcomm can be compared in terms of their leadership styles, strategic decisions, and the company's growth and challenges during their respective tenures.

**Irwin Jacobs:**
1. **Founding and Vision:** Irwin Jacobs co-founded Qualcomm in 1985, bringing his expertise in digital communications and information theory to the company. His vision was to revolutionize the telecommunications industry by introducing digital cellular technology, specifically through the development and implementation of CDMA (Code Division Multiple Access) technology.
   
2. **Strategic Innovations:** Under Irwin's leadership, Qualcomm patented CDMA technology, which became a cornerstone of the company's success. This technology allowed for more efficient use of the radio spectrum, enabling more simultaneous calls and better voice quality compared to the existing analog systems. Irwin's foresight in recognizing the potential of digital communications and his strategic decision to patent CDMA were pivotal in establishing Qualcomm as a leader in the telecommunications industry.

3. **Business Model and Growth:** Irwin Jacobs was instrumental in developing Qualcomm's business model, which included licensing its CDMA technology to other companies. This model generated significant revenue and positioned Qualcomm as a key player in the global telecommunications market. The company's growth during Irwin's tenure was marked by the widespread adoption of CDMA technology and the expansion of Qualcomm's influence in the industry.

4. **Philanthropy and Legacy:** Irwin Jacobs is also known for his philanthropic efforts, particularly in the San Diego area, where Qualcomm is headquartered. His contributions to education and community development have left a lasting impact beyond the business realm.

**Paul Jacobs:**
1. **Leadership Transition:** Paul Jacobs took over as CEO in 2005, succeeding his father. He inherited a company that was already a leader in the telecommunications industry, with a strong foundation in CDMA technology and a successful licensing business.

2. **Strategic Challenges and Initiatives:** During Paul's tenure, Qualcomm faced several challenges, including increased competition and legal battles over its licensing practices. Paul Jacobs attempted to diversify Qualcomm's business by investing in new areas such as IoT (Internet of Things) and automotive technologies. However, these initiatives did not achieve the expected success during his leadership.

3. **Legal and Competitive Pressures:** Under Paul's leadership, Qualcomm became embroiled in numerous legal disputes, including antitrust lawsuits and challenges to its licensing practices. These legal battles, along with growing competition from companies like Intel and Mediatek, put pressure on Qualcomm's business model and market position.

4. **Mixed Legacy:** While Paul Jacobs continued to drive innovation at Qualcomm, his tenure is viewed with mixed results. The company maintained its leadership in the mobile chip market, but it also faced significant challenges that impacted its reputation and financial performance.

In summary, Irwin Jacobs' impact on Qualcomm was foundational, characterized by visionary leadership, strategic innovation, and the establishment of a successful business model. Paul Jacobs' tenure was marked by efforts to diversify and adapt to a changing industry landscape, but it also faced significant challenges and legal issues. Irwin's leadership laid the groundwork for Qualcomm's success, while Paul's leadership navigated the complexities of a mature and competitive market.",0.9106690596804883,1.0,0.94
12,What is the Scandinavian connection to Qualcomm's early rise?,The exact information regarding the Scandinavian connection to Qualcomm's early rise is not included in the provided context.,0.19580198948767508,1.0,1.0
13,When did AWS formed and who first head of AWS techincally?,"AWS, or Amazon Web Services, was formed in the early 2000s. The initial concept and development of AWS began around 2002 when Amazon started exploring the idea of providing web services and APIs to developers. The official launch of AWS as a cloud computing platform occurred in 2006 with the release of its first services, such as S3 (Simple Storage Service) and EC2 (Elastic Compute Cloud).

The first head of AWS, technically, was Collin Brier. At the time, AWS was part of the Amazon Associates Program, and Collin Brier was responsible for running it. This was before AWS evolved into the cloud computing giant it is known as today. Later, Andy Jassy took over AWS and played a significant role in its development and growth into a major business unit within Amazon.",0.8887062797813334,0.8333333333333334,1.0
14,What was the final words by Amazon CTO Werner Vogels in Quora Post in 2011?,"In a Quora post in 2011, Amazon CTO Werner Vogels addressed the myth regarding the origins of Amazon Web Services (AWS). He stated, ""The excess capacity story is a myth. It was never a matter of selling excess capacity. Actually, within two months after launch, AWS would have already burned through the excess amazon.com capacity. Amazon Web Services was always considered a business by itself with the expectation that it could even grow as big as the amazon.com retail operation."" This statement clarifies that AWS was not simply a way to monetize unused server capacity from Amazon's retail operations, but rather a strategic business initiative with its own growth expectations.",0.9622459324151743,1.0,0.0
15,What boots and jacket we often see Jeff Bezos in ?,The provided context does not include specific information about the boots and jacket that Jeff Bezos is often seen wearing.,0.22873444064741877,1.0,0.0
16,Where is Blue Origins operations are based in?,The exact information about where Blue Origin's operations are based is not included in the provided context.,0.18637043354955246,1.0,1.0
17,Which was one of the first free email services?,The exact information about one of the first free email services is not included in the provided context.,0.17198024938296017,1.0,1.0
18,When was the summit that eventually lead to the creation of Visa?,"The summit that eventually led to the creation of Visa took place in October 1968. This summit was organized by the franchisee banks of Bank of America's BankAmericard program, who were frustrated with the operational issues and lack of support from Bank of America. The meeting was held in Columbus, Ohio, where the franchisees demanded a resolution to their grievances. During the summit, Dee Hock, who was the BankAmericard franchisee program manager from the Seattle National Bank of Commerce, proposed that instead of merely reporting grievances back to Bank of America, the committee should design a new way of operating the system. This proposal was accepted, and it set the stage for the creation of a new organization that would eventually become Visa.",0.9939913352367424,1.0,1.0
19,What is Visa's net income margin and is there a company with a better margin?,"Visa's net income margin is 50%. This is an exceptionally high margin, especially for a company of Visa's size and scale. In the context provided, it is noted that Visa's net income margin is likely the highest among large-scale companies globally. For comparison, other major companies have significantly lower net income margins: Microsoft has a net income margin of 34%, Apple has 25%, and Google has 21%. Even MasterCard, which operates in the same industry as Visa, has a lower net income margin of 43%. Therefore, based on the provided context, there is no mention of another company with a better net income margin than Visa.",0.95,1.0,1.0
20,Visa is the global sponsor of what?,"Visa is the global sponsor of the Olympics. This sponsorship began in 1986 when the International Olympic Committee (IOC) offered companies the opportunity to become global sponsors of the Olympics for the first time. Prior to this, companies could only sponsor the Olympics in specific countries. Visa seized this opportunity after American Express, a major Olympic sponsor in the United States, declined the offer to become a global sponsor. Visa's decision to become the founding global Olympic sponsor involved a significant investment, including $17 million just for the rights and an additional $23 million in media for the 1988 Olympics, totaling $40 million, which is about $110 million in today's dollars. This sponsorship has been a long-term commitment, with Visa being the exclusive payment provider at the Olympics, and they are contracted to continue this sponsorship through at least 2032. This strategic move has helped Visa strengthen its brand association with the Olympics globally.",0.9939913346663323,1.0,0.5714285714285714
21,"In 1976, Steve Jobs along with Steve Wozniak created the game, Breakout, for Atari and Nolan Bushnell. Three industries were born concurrent with the creation of this game. What where they?","In 1976, Steve Jobs, along with Steve Wozniak, created the game Breakout for Atari and Nolan Bushnell. The creation of this game coincided with the birth of three significant industries:

1. **Home Video Game Console Industry**: This industry was initiated by the Magnavox Odyssey, which was the first home video game console. Atari, inspired by the Odyssey, developed Pong, which became a massive success and helped establish the home video game console market. The creation of Breakout further solidified Atari's position in this burgeoning industry.

2. **Arcade Video Game Industry**: Atari's success with Pong and subsequent games like Breakout contributed to the rapid growth of the arcade video game industry. By the late 1970s, arcade games were generating billions of dollars in annual revenue, with titles like Space Invaders leading the charge. This industry quickly became larger than both the movie and music industries combined.

3. **Personal Home Computer Industry**: The development of Breakout by Steve Jobs and Steve Wozniak also foreshadowed the rise of the personal home computer industry. Jobs and Wozniak would go on to found Apple, which played a pivotal role in the development and popularization of personal computers. The skills and innovations they honed while working on projects like Breakout were instrumental in their later success with Apple.

These three industries emerged concurrently with the creation of Breakout, each contributing to the broader landscape of technology and entertainment in significant ways.",0.9062243381162393,0.9090909090909091,0.7142857142857143
22,What does Nintendo mean?,"Nintendo's name is derived from the kanji characters Nin, Ten, and Do, which can be interpreted as ""leave luck to heaven."" This phrase references the element of luck in playing cards, which was Nintendo's original business. It also reflects the entrepreneurial spirit of a new venture. Additionally, the character Ten at the time was a clear reference to the mythical spirit, Tengu, which was a coded reference for gambling and casinos, activities that were very much illegal at the time Nintendo was founded. Thus, the name Nintendo carries multiple meanings related to its origins in the playing card and gambling business.",0.9033878611948486,1.0,1.0
23,What was a key strength of Hiroshi Yamauchi? This is something that he was just good at. ,The exact information about Hiroshi Yamauchi's key strength is not included in the provided context.,0.15653151267777252,1.0,1.0
24,"What are the 3 interrelated things that make Renaissance Technologies unique from other investment firms with similar commodities (smartest people with the best data and infrastructure), such as Citadel, DE Saw, Two Sigma, and Jane Street?","Renaissance Technologies (RenTech) distinguishes itself from other investment firms with similar resources, such as Citadel, D.E. Shaw, Two Sigma, and Jane Street, through three interrelated factors:

1. **Collaboration Over Competition**: RenTech fosters a culture where the smartest people in the world collaborate rather than compete. Unlike other financial firms where employees and teams often compete with one another, RenTech operates with a single model architecture. This means everyone works together on the same investment strategy and infrastructure, allowing all employees to see and contribute to each other's work. This collaborative environment ensures that when one team improves the model's performance, it benefits everyone equally, aligning incentives across the firm.

2. **Small, Cohesive Team**: RenTech operates with an exceptionally small team compared to its peers. With less than 400 employees, only about half of whom are involved in research and engineering, RenTech maintains a tight-knit community. This small size fosters a collegial atmosphere where everyone knows each other personally, enhancing collaboration and loyalty. The firm is located in a relatively isolated area on Long Island, which further strengthens the community feel and reduces external distractions and influences.

3. **Unique Incentive Structure**: RenTech employs a distinctive LP-GP fund structure with high management fees and carry, even though the GPs and LPs are the same people. This structure acts as a value transfer mechanism from the tenure base to the current team working on Medallion in any given year. Newer employees benefit from the high carry, while longer-tenured employees benefit from their growing LP stake. This setup ensures that all employees are highly incentivized to contribute to the firm's success, aligning short-term and long-term interests and reducing the likelihood of talent leaving to start competing ventures.

These elements combine to create a unique environment at RenTech that maximizes collaboration, maintains a strong community, and aligns incentives in a way that is distinct from other firms in the industry.",0.9851952805752188,1.0,1.0
