row_number,question,answer,coherence_score,faithfulness_score,answer_relevancy_score
52,What is the connection to Vitalik to the year 1994 and what was his parent's condition and Russia during the time?,"Vitalik Buterin was born in January 1994 in Russia. At the time of his birth, his parents were undergraduate computer science students. The context describes Russia during this period as being in a state of significant turmoil. The Soviet Union had collapsed a few years prior, leading to hyperinflation, a depression, and widespread economic hardship. Life expectancy in Russia had declined by over 10 years from the collapse of the Soviet Union to the time of Vitalik's birth, with the average life expectancy dropping to around 50 years. Additionally, Vitalik's parents divorced not long after he was born, although they maintained an amicable relationship and prioritized providing Vitalik with opportunities.",0.88089783440604,1.0,1.0
53,What was argument before Vtalik's presentation in Miami?,The exact information about the argument before Vitalik's presentation in Miami is not included in the provided context.,0.17766585296153092,1.0,1.0
54,what was the worst stock price percentage down in a day for NVIDIA ?,"The context provided does not specify the exact worst stock price percentage down in a day for NVIDIA. It mentions several instances where NVIDIA's stock experienced significant declines, such as an 80% drop during the financial crisis and a 50% drawdown in 2011 and again in 2018, but it does not specify the worst single-day percentage drop.",0.7999999999999999,1.0,1.0
55,"In 2012, What is the  competition against imageNet Database and what was the error rate compared to others & who won the competition?","In 2012, the ImageNet competition was won by a team from the University of Toronto. They submitted an algorithm called AlexNet, which was a convolutional neural network, a branch of artificial intelligence known as deep learning. AlexNet achieved a significant breakthrough by winning the competition with an error rate of approximately 15%. This was a substantial improvement over the best previous algorithms, which had error rates of around 25%. The success of AlexNet marked a pivotal moment in the field of artificial intelligence, demonstrating the potential of deep learning and neural networks when implemented on GPUs, specifically using NVIDIA's CUDA platform.",0.998593637401056,1.0,1.0
56,What is NVIDIA free cash flow in billions  every year? ,NVIDIA generates $8 billion of free cash flow every year.,0.1496126513800501,1.0,1.0
57,What is the difference between recurrent neural networks and convolutional neural networks?,"Recurrent Neural Networks (RNNs) and Convolutional Neural Networks (CNNs) are both types of artificial neural networks used for different types of tasks in machine learning, and they have distinct architectures and applications.

**Recurrent Neural Networks (RNNs):**

1. **Architecture and Functionality:**
   - RNNs are designed to recognize patterns in sequences of data, such as time series or natural language.
   - They have a unique architecture that includes loops, allowing information to persist. This means they can use their internal state (memory) to process sequences of inputs.
   - RNNs are particularly useful for tasks where the context or order of the data is important, such as language modeling, speech recognition, and time-series prediction.

2. **Sequential Processing:**
   - RNNs process inputs sequentially, maintaining a 'memory' of previous inputs in the sequence. This makes them suitable for tasks where the order of data points is crucial.
   - However, this sequential nature can lead to difficulties in training, such as the vanishing gradient problem, which makes it hard for RNNs to learn long-range dependencies.

3. **Limitations:**
   - RNNs have a relatively short context window, meaning they can struggle to remember information from earlier in the sequence when processing long sequences.

**Convolutional Neural Networks (CNNs):**

1. **Architecture and Functionality:**
   - CNNs are primarily used for processing data with a grid-like topology, such as images.
   - They consist of layers that apply convolution operations to the input, which helps in capturing spatial hierarchies in the data.
   - CNNs are particularly effective for image-related tasks, such as image classification, object detection, and image segmentation.

2. **Parallel Processing:**
   - CNNs can process multiple parts of the input data simultaneously, making them highly efficient for tasks where the spatial arrangement of data is important.
   - This parallelism allows CNNs to be trained more efficiently on large datasets compared to RNNs.

3. **Limitations:**
   - CNNs are not inherently designed to handle sequential data or data where the temporal order is important, which is where RNNs excel.

In summary, RNNs are suited for sequential data where the order of inputs matters, while CNNs are designed for spatial data, such as images, where the arrangement of data points is crucial. Each type of network has its strengths and is chosen based on the specific requirements of the task at hand.",0.9437823499114202,1.0,1.0
58,What did Jensen Huang say in the Stratechery interview in March 2023 about the year 2022?,The exact information about what Jensen Huang said in the Stratechery interview in March 2023 regarding the year 2022 is not included in the provided context.,0.19999999999999998,1.0,1.0
59,What is CUDA's most unique feature?,"CUDA's most unique feature is its ability to enable general-purpose computing on NVIDIA GPUs through a comprehensive development framework. This framework includes a programming model that supports parallel computing, which is essential for leveraging the thousands of cores available on modern GPUs. CUDA is not just a programming language or an API; it is a full stack that includes compilers, libraries, and tools designed to optimize and accelerate computing tasks across various domains.

One of the standout aspects of CUDA is its integration with NVIDIA's hardware, making it proprietary and exclusive to NVIDIA GPUs. This means that any software developed using CUDA can only be deployed on NVIDIA hardware, creating a strong lock-in effect for developers and enterprises that choose to use it. This exclusivity is a strategic advantage for NVIDIA, as it ties the software ecosystem directly to their hardware products.

CUDA's design for parallel execution from the ground up allows it to handle tasks that are ""embarrassingly parallel,"" such as deep learning and scientific computing, with exceptional efficiency. This capability has made it a critical tool in the rise of AI and machine learning, where massive parallel processing is required to train complex models.

Overall, CUDA's unique feature lies in its comprehensive, integrated approach to enabling high-performance parallel computing on NVIDIA GPUs, supported by a robust ecosystem of tools and libraries that cater to a wide range of scientific, industrial, and commercial applications.",0.9679178688280642,1.0,1.0
60,Where did the issuance of the first banknotes originate?,The exact information about the origin of the issuance of the first banknotes is not included in the provided context.,0.19445780863711837,1.0,1.0
61,what happen on 2013 in relation to bitcoin ,"In 2013, several significant events occurred in relation to Bitcoin:

1. **Silk Road Shutdown**: The Silk Road, an online black market and the first modern darknet market, was shut down by the FBI in October 2013. The Silk Road had been a major platform for illegal transactions using Bitcoin, which significantly contributed to Bitcoin's early adoption and transaction volume. The FBI arrested Ross Ulbricht, who was operating under the pseudonym ""Dread Pirate Roberts,"" at the Glen Park Library in San Francisco. This event marked a major crackdown on illegal activities facilitated by Bitcoin.

2. **Bitcoin Price Surge**: Despite the shutdown of Silk Road, 2013 was a breakout year for Bitcoin in terms of price. The price of Bitcoin started the year at just over $13 and surged to $770 by January 1, 2014. This dramatic increase in price was part of a broader trend of growing interest and investment in Bitcoin.

3. **Mt. Gox Issues**: Mt. Gox, the largest Bitcoin exchange at the time, began experiencing significant issues in 2013. In April, the exchange was overwhelmed by trading volume, leading to a suspension of trading and a subsequent crash in Bitcoin's price. By June, Mt. Gox stopped allowing withdrawals in US dollars, signaling deeper operational problems that would eventually lead to its collapse in early 2014.

These events collectively contributed to both the growing mainstream awareness of Bitcoin and the volatility that characterized its early years.",0.9132964256337693,1.0,1.0
62,does bitcoin have a higher appreciation per year as compared to gold?,"The provided context does not include specific information comparing the annual appreciation rates of Bitcoin and gold. Therefore, I cannot determine whether Bitcoin has a higher appreciation per year compared to gold based on the context given.",0.6838044650322168,1.0,0.5
63,how did Winklevoss brother changed the bitcoin market ,The exact information about how the Winklevoss brothers changed the Bitcoin market is not included in the provided context.,0.17953946577706198,1.0,1.0
64,"In February 1967, Warren Buffet decide to transform Berkshire into an insurance company. How much time did it take for Warrne Buffet to work out on a deal?","In February 1967, Warren Buffett worked out a deal to transform Berkshire into an insurance company in just 15 minutes. He was having lunch with Jack Ringwalt, the owner of National Indemnity, and managed to negotiate the purchase of the company for Berkshire Hathaway in that short amount of time. Buffett agreed to the price Ringwalt wanted, without requiring audited financials, and promised to keep the company in Omaha and not to fire any employees. This quick negotiation was part of Buffett's strategy to transform Berkshire Hathaway from a failing textile manufacturer into a successful insurance company, leveraging the float from the insurance business to fuel further investments.",0.9777299861174692,1.0,0.8571428571428571
65,What is Warren Buffet net worth after working at Graham-Newman for two years?,"After working at Graham-Newman for two years, Warren Buffett's net worth was about $175,000. This amount was significantly higher than the average yearly salary for a worker in the United States at that time, which was $4,800. At 26 years old, Buffett had accumulated this substantial net worth, which was equivalent to a few million dollars in today's terms.",0.906601039719973,1.0,1.0
66,On which day of the week did Warren Buffet talked with Lorimer and for how long?,Warren Buffett talked with Lorimer Davidson on a Saturday morning. They had a conversation that lasted for four hours.,0.4421369748421634,1.0,1.0
67,"Which company, in addition to Facebook and Google, showed interest in WhatsApp?","In addition to Facebook and Google, Tencent showed interest in acquiring WhatsApp. The context reveals that Tencent, which is a major player in the social and messaging app space in China with its WeChat platform, was ready to make a deal to buy WhatsApp for a price in the high single-digit billions. The deal was reportedly quite advanced, and Pony Ma, the CEO of Tencent, was scheduled to travel to California to finalize the acquisition with Jan Koum, Brian Acton, and Jim Goetz. However, the trip was delayed due to Pony Ma needing back surgery. This delay occurred around late January to early February 2014, during which time Facebook's Mark Zuckerberg also made a move to acquire WhatsApp, ultimately succeeding with a $19 billion offer.",0.9106929730101336,0.875,0.3
68,"During high school year, which online security community Jan Koum was part of? ",The exact information about which online security community Jan Koum was part of during his high school years is not included in the provided context.,0.2041575659253536,1.0,1.0
69,What business strategies did Jan used to increase the popularity of the WhatsApp product?,"Jan Koum employed several strategic approaches to increase the popularity of WhatsApp:

1. **Leveraging the Address Book**: One of the key innovations was using phone numbers as identifiers instead of usernames. This allowed WhatsApp to automatically connect users with their existing contacts, solving the cold start problem that many social networks face. By accessing the phone's address book, WhatsApp could immediately show users which of their contacts were already using the app, facilitating instant communication without the need for users to manually add friends.

2. **Growth Hacks**: In the early days, Jan used a clever growth hack by frequently changing the app's name slightly. This tactic ensured that WhatsApp appeared in the ""What's New"" section of the App Store regularly, attracting new users who were browsing for new apps.

3. **Push Notifications**: The introduction of push notifications for third-party apps by Apple was a turning point. Initially, Jan used push notifications to broadcast status updates to all contacts, but this feature quickly evolved into a full-fledged messaging service. Push notifications allowed WhatsApp to engage users more effectively by alerting them to new messages, which was crucial for a messaging app.

4. **Monetization Strategy**: WhatsApp initially charged a $0.99 fee for the app in certain markets. This not only provided a revenue stream to cover server costs but also helped manage growth by slightly throttling the rate of new user acquisition, ensuring that the infrastructure could keep up with demand.

5. **Focus on User Experience**: WhatsApp was designed to be simple and straightforward, focusing on core messaging functionality without the clutter of additional features. This simplicity made it appealing to a broad audience, especially in international markets where users were looking for a reliable SMS alternative.

6. **International Appeal**: By offering a cost-effective alternative to SMS, especially in regions where texting was expensive, WhatsApp quickly gained traction. The app's ability to send messages over data networks rather than traditional SMS networks was a significant draw for users in countries with high SMS costs.

7. **End-to-End Encryption**: WhatsApp implemented full end-to-end encryption, which became a significant selling point for privacy-conscious users. This move not only enhanced user trust but also differentiated WhatsApp from other messaging services that did not offer the same level of security.

These strategies collectively contributed to WhatsApp's rapid growth and widespread adoption, making it the most popular messaging application in the world by 2015.",0.9777299857712596,0.95,1.0
70,What company did Disney invest in and eventually purchase for the technology to enable their streaming services platform?,"Disney invested in and eventually purchased BAMTech for the technology to enable their streaming services platform. Initially, Disney acquired a minority stake in BAMTech for $1 billion in 2016. They later acquired a majority stake in 2017, spending a total of $2.6 billion. BAMTech was a technology provider known for delivering streaming content, both for live sports and entertainment services. This acquisition was strategic for Disney as it provided the necessary technology infrastructure to launch and support their streaming services, including ESPN Plus and Disney Plus. BAMTech was considered the best in the business, other than Netflix, for delivering streaming content, making it a crucial component in Disney's transition to direct-to-consumer streaming services.",0.9880797074828074,1.0,1.0
71,What was the result of the shareholder no confidence bid against Bob Eisner after the failed Disney takeover bid by Comcast?,"The shareholder no confidence bid against Michael Eisner, not Bob Eisner, resulted in a significant outcome. During the March 2004 shareholder meeting, an astounding 43% of Disney shareholders voted no confidence in Eisner. This level of dissent was highly unusual and indicated a strong lack of support for Eisner's leadership. In the immediate aftermath of the vote, the Disney board convened and decided to strip Eisner of his chairman title, although he remained CEO. Eisner subsequently announced that he would step down from the company at the end of his contract, which was set to expire in 2006. However, he ended up leaving earlier than planned. This marked a significant turning point for Disney, as it led to a search for a new CEO, with Bob Iger eventually being appointed to the position.",0.9377540664098072,1.0,0.8571428571428571
72,What position did Bob Eisner have and in what company when Disney acquired it?,"Bob Iger was the President of ABC when Disney acquired Capital Cities/ABC in 1995. At the time of the acquisition, he was responsible for overseeing ABC's sports, news, and entertainment divisions.",0.8097215830055042,1.0,1.0
73,What did Jeffrey Skilling say to the dean of Harvard Business School during his entrance interview?,"During his entrance interview with the dean of Harvard Business School, Jeffrey Skilling was asked if he was smart. Skilling responded to the dean by saying, ""I'm effing smart,"" although he did not use the exact words ""effing,"" as this is a family-friendly paraphrase. This response is indicative of Skilling's confidence and assertiveness, traits that were notable throughout his career.",0.8883687939489032,1.0,1.0
74,What was the singular condition that Jeffrey Skilling requested before joining Enron?,"Jeffrey Skilling insisted that Enron adopt mark-to-market accounting as a condition for him joining the company. This was a non-negotiable requirement for Skilling, as he realized that he could not build the business he envisioned without this accounting method. Mark-to-market accounting allowed Enron to recognize projected future cash flows from contracts as current revenue, which was crucial for the type of financial operations Skilling wanted to implement at Enron. Despite initial resistance from Arthur Andersen, Enron's auditors, and the SEC, Skilling was able to convince the SEC to allow Enron to use this accounting method, which played a significant role in the company's financial practices and eventual downfall.",0.9777299854250499,0.75,0.625
75,What historic event took investigative pressure off of Enron before its stock collapsed?,"The historic event that took investigative pressure off of Enron before its stock collapsed was the September 11th terrorist attacks in 2001. The attacks caused a significant distraction for the media, investors, and the general public, which temporarily shifted attention away from the growing scrutiny and financial issues at Enron. This reprieve allowed Enron to avoid immediate collapse, as the focus on the attacks and their aftermath provided a temporary cover for the company's deteriorating financial situation. However, this was only a short-lived respite, as the scrutiny resumed once the immediate aftermath of the attacks subsided, leading to the eventual exposure of Enron's financial malpractices and its subsequent bankruptcy.",0.9679178699175394,1.0,1.0
76,How did Enron remove investments from its accounting books?,"Enron removed investments from its accounting books by using special-purpose entities (SPEs). These entities were separate legal structures that allowed Enron to offload investments and liabilities from its balance sheet. The key mechanism was that as long as at least 3% of the capital in an SPE came from outside investors, Enron could still own 97% of the economics of that entity and remove it from its consolidated accounting books. This meant that Enron could effectively hide debt and losses by transferring them to these SPEs, making its financial statements appear healthier than they actually were.

Enron's CFO, Andrew Fastow, played a significant role in setting up these SPEs. He created a fund, LJM Capital, which was used to provide the necessary 3% outside capital for these entities. Fastow was both the CFO of Enron and the general partner of LJM, creating a significant conflict of interest. This arrangement allowed Enron to engage in transactions with these SPEs, recognizing revenue from these deals and further inflating its financial performance.

The use of SPEs was a critical part of Enron's strategy to manipulate its financial statements, ultimately contributing to the company's collapse when the true nature of these off-balance-sheet liabilities was revealed.",0.986703575057939,1.0,1.0
77,The fall of Enron is similar to what other bankruptcy from 2022?,"The fall of Enron is similar to the bankruptcy of FTX in 2022. Both cases involve significant financial fraud and mismanagement, leading to the collapse of large companies that were once highly regarded in their respective industries.

1. **Fraud and Mismanagement**: Both Enron and FTX were involved in fraudulent activities and mismanagement. Enron used complex accounting practices, such as mark-to-market accounting and off-balance-sheet entities, to hide its financial losses and inflate its profits. Similarly, FTX was involved in misusing customer funds and lacked proper financial controls, leading to its downfall.

2. **Market Manipulation**: Enron manipulated energy markets, particularly in California, to create artificial shortages and drive up prices, which contributed to its eventual collapse. FTX, on the other hand, was involved in risky trading practices and allegedly used its own token, FTT, as collateral, which contributed to its financial instability.

3. **Impact on Stakeholders**: Both collapses had significant impacts on stakeholders. Enron's bankruptcy affected thousands of employees, investors, and pension funds, leading to substantial financial losses. FTX's collapse similarly affected investors, customers, and the broader cryptocurrency market, causing significant financial losses and shaking confidence in the industry.

4. **Regulatory and Legal Consequences**: The Enron scandal led to the creation of the Sarbanes-Oxley Act, which aimed to improve corporate governance and financial transparency. The FTX collapse has prompted calls for increased regulation and oversight in the cryptocurrency industry to prevent similar incidents in the future.

5. **Public and Media Attention**: Both cases received extensive media coverage and public attention due to the scale of the fraud and the prominence of the companies involved. Enron was once the seventh-largest company in the U.S., while FTX was a major player in the cryptocurrency market.

Overall, the fall of Enron and the bankruptcy of FTX share similarities in terms of fraudulent practices, market manipulation, and the significant impact on stakeholders, leading to increased scrutiny and calls for regulatory reforms in their respective industries.",0.9500000000000002,1.0,0.7777777777777778
78,What metrics did FTX judge itself by?,"FTX judged itself by several key metrics, focusing on both its market position and operational performance. Here are the primary metrics mentioned in the context:

1. **Volume and Market Position**: FTX tracked its growth in terms of trading volume and its ranking among global exchanges. As of the time discussed, FTX was the third largest by volume and the second largest by open interest, with a typical daily volume of around $15 billion globally.

2. **User Base**: The number of users was another important metric, with FTX having a few million users at the time.

3. **Product Offering and Innovation**: FTX aimed to expand its product suite, particularly in the U.S. market, where it anticipated launching derivatives. The ability to innovate and offer new products was a critical measure of success.

4. **Regulatory Engagement**: FTX placed importance on its regulatory strategy, including acquiring licenses and engaging with regulators, as evidenced by its acquisition of LedgerX to facilitate the launch of derivatives in the U.S.

5. **Brand and Trust**: While not a direct metric, FTX focused on building its brand and trust through strategic partnerships and endorsements, which were seen as essential for long-term success and market expansion.

These metrics reflect FTX's strategic focus on growth, market leadership, product innovation, regulatory compliance, and brand development.",0.9268941421369993,1.0,1.0
79,When was Trip Hawkins exposed to Computers?,"Trip Hawkins was first exposed to computers during his high school years. He was trying to engage his friends in playing strategy games, which he found mentally stimulating, but many found them too complex and time-consuming. This led him to the realization that computers could automate the administrative aspects of these games, making them more accessible and engaging. This exposure to computers sparked his interest in using them to create interactive experiences, which eventually influenced his career path in the gaming industry.",0.9817574473210714,1.0,0.25
80,What was Trip Hawkins favorite game growing up?,"Trip Hawkins' favorite game growing up was Strat-O-Matic. He discovered this game, which involved rolling dice and using player cards to simulate baseball games, when he was about 10 years old. Hawkins was fascinated by the strategy involved in the game and even figured out Bayesian probability theory from studying the dice. He realized the significance of the different probabilities associated with rolling certain numbers, which influenced his strategic decisions in the game. This early interest in games and strategy played a significant role in shaping his future career in the gaming industry.",0.9904650542864106,1.0,1.0
